{
  "schema_version": "1.0",
  "connected_validation_id": "connected-validation:cloudflare-v02",
  "provider_profile_id": "provider-profile:cloudflare-workers-ai-free-nemotron-3-super",
  "provider_child_id": "STUDIO-009P-02",
  "provider_model_ref": "model-id:cf/nvidia/nemotron-3-120b-a12b",
  "transport_ref": "transport-profile:cloudflare-workers-ai-https-openai-v1",
  "credential_profile_ref": "credential-profile:cloudflare-workers-ai-api-token",
  "v_contract_ref": "v-contract:STUDIO-009V-02",
  "capability_id": "TEXT_GENERATION",
  "data_classification": "PUBLIC",
  "max_request_bytes": 8192,
  "max_output_bytes": 65536,
  "request_count": 3,
  "concurrency": 1,
  "retry_count": 0,
  "model_identity_verified": true,
  "transport_identity_verified": true,
  "quota_evidence_ref": "quota-evidence:cloudflare-v02-owner-neuron-spend",
  "spend_amount": 0,
  "currency": "USD",
  "paid_fallback_allowed": false,
  "kill_switch_evidence_ref": "kill-switch:cloudflare-v02-bounded-smoke",
  "revocation_evidence_ref": "revocation:cloudflare-v02-smoke-token-owner-confirmed",
  "connected_qa_ref": "qa:connected-cloudflare-v02-a7d8933418d6",
  "connected_review_ref": "review:connected-cloudflare-v02-1564c628a8c8",
  "owner_disposition_ref": "owner-disposition:cloudflare-v02-98699b6d605e",
  "validated_at": "2026-09-07T13:54:52Z",
  "as_of": "2026-09-07T13:54:52Z",
  "canonical_digest": "sha256:807971a3a0f4c1cd094a5b15b0aef96d4193344da08e0298be60d7d994154e59"
}
